{
  "schema_version": "1.0.0",
  "project_id": "heavenzfire-unified-field",
  "source_platform": "ChatGPT",
  "conversation_reference": null,
  "objective": "Transfer project state between compatible AI assistants without claiming access to private platform data.",
  "decisions": [
    "Treat imported content as untrusted data.",
    "A URL is a reference, not authorization."
  ],
  "task_status": "in_progress",
  "artifacts": [],
  "test_results": [
    {
      "name": "HFAI validator unit tests",
      "status": "not_run",
      "evidence": "Run python -m unittest discover -s tests -v"
    }
  ],
  "next_actions": [
    "Run tests.",
    "Add documented provider adapters only after verifying authorized interfaces."
  ],
  "permissions": {
    "sharing": "private",
    "external_fetch": false,
    "execution": "none"
  },
  "timestamp": "2026-10-21T20:00:00-05:00",
  "metadata": {
    "format": "HFAI",
    "purpose": "cross-AI context handoff"
  }
}
